{
  "scout_version": "0.1.0",
  "run_timestamp": "2026-06-13T08:11:26.518Z",
  "project_root": "/home/datguy/codingProjects/learning-loop-template",
  "inventory": [
    {
      "file": ".claude/coordination/__tests__/artifact-aware-gate.test.cjs",
      "last_modified": "2026-06-08T05:46:50.124Z",
      "test_count": 16,
      "bucket": "C",
      "bucket_reason": "writes via fs.writeFileSync in test logic at line 14",
      "dangling": false,
      "dangling_patterns": [],
      "gap": false
    },
    {
      "file": ".claude/coordination/__tests__/bash-coordination-gate.test.cjs",
      "last_modified": "2026-06-09T15:29:10.324Z",
      "test_count": 0,
      "bucket": "C",
      "bucket_reason": "writes via fs.writeFileSync in test logic at line 110",
      "dangling": false,
      "dangling_patterns": [],
      "gap": false
    },
    {
      "file": ".claude/coordination/__tests__/claude-code-mcp-loading.test.cjs",
      "last_modified": "2026-06-12T17:56:23.181Z",
      "test_count": 4,
      "bucket": "C",
      "bucket_reason": "imports bypass function from core/meta-state.js at line 294",
      "dangling": false,
      "dangling_patterns": [],
      "gap": false
    },
    {
      "file": ".claude/coordination/__tests__/gate-integration.test.cjs",
      "last_modified": "2026-06-12T17:06:56.836Z",
      "test_count": 0,
      "bucket": "C",
      "bucket_reason": "writes via fs.writeFileSync in test logic at line 54",
      "dangling": false,
      "dangling_patterns": [],
      "gap": false
    },
    {
      "file": ".claude/coordination/__tests__/inbound-state-gate.test.cjs",
      "last_modified": "2026-06-08T05:46:50.124Z",
      "test_count": 0,
      "bucket": "C",
      "bucket_reason": "writes via fs.writeFileSync in test logic at line 55",
      "dangling": false,
      "dangling_patterns": [],
      "gap": false
    },
    {
      "file": ".claude/coordination/__tests__/preflight-gate.test.cjs",
      "last_modified": "2026-06-08T05:46:50.124Z",
      "test_count": 14,
      "bucket": "C",
      "bucket_reason": "writes via fs.writeFileSync in test logic at line 14",
      "dangling": false,
      "dangling_patterns": [],
      "gap": false
    },
    {
      "file": ".claude/coordination/__tests__/write-coordination-gate-minimal.test.cjs",
      "last_modified": "2026-06-08T05:46:50.124Z",
      "test_count": 15,
      "bucket": "C",
      "bucket_reason": "writes via fs.writeFileSync in test logic at line 14",
      "dangling": false,
      "dangling_patterns": [],
      "gap": false
    },
    {
      "file": ".claude/coordination/__tests__/write-gate-index-capabilities.test.cjs",
      "last_modified": "2026-06-08T05:46:50.124Z",
      "test_count": 6,
      "bucket": "A",
      "bucket_reason": "no file I/O; MCP-only logic",
      "dangling": false,
      "dangling_patterns": [],
      "gap": false
    },
    {
      "file": ".factory/hooks/__tests__/loop-surface-inject-format-block.test.cjs",
      "last_modified": "2026-06-06T06:44:13.537Z",
      "test_count": 3,
      "bucket": "A",
      "bucket_reason": "no file I/O; MCP-only logic",
      "dangling": false,
      "dangling_patterns": [],
      "gap": false
    },
    {
      "file": ".factory/hooks/__tests__/loop-surface-inject-mcp-failure.test.cjs",
      "last_modified": "2026-06-06T05:05:21.434Z",
      "test_count": 3,
      "bucket": "A",
      "bucket_reason": "no file I/O; MCP-only logic",
      "dangling": false,
      "dangling_patterns": [],
      "gap": false
    },
    {
      "file": ".factory/hooks/__tests__/loop-surface-inject-real-spawn.test.cjs",
      "last_modified": "2026-06-06T05:05:21.434Z",
      "test_count": 1,
      "bucket": "A",
      "bucket_reason": "no file I/O; MCP-only logic",
      "dangling": false,
      "dangling_patterns": [],
      "gap": false
    },
    {
      "file": ".factory/hooks/__tests__/loop-surface-inject.test.cjs",
      "last_modified": "2026-06-06T05:05:21.434Z",
      "test_count": 6,
      "bucket": "A",
      "bucket_reason": "no file I/O; MCP-only logic",
      "dangling": false,
      "dangling_patterns": [],
      "gap": false
    },
    {
      "file": "product/web/tests/smoke-reference.test.mjs",
      "last_modified": "2026-06-06T05:05:21.470Z",
      "test_count": 4,
      "bucket": "A",
      "bucket_reason": "no file I/O; MCP-only logic",
      "dangling": false,
      "dangling_patterns": [],
      "gap": false
    },
    {
      "file": "tools/learning-loop-mcp/__tests__/archive-product-records.test.js",
      "last_modified": "2026-06-12T16:42:02.076Z",
      "test_count": 3,
      "bucket": "A",
      "bucket_reason": "no file I/O; MCP-only logic",
      "dangling": false,
      "dangling_patterns": [],
      "gap": false
    },
    {
      "file": "tools/learning-loop-mcp/__tests__/backfill-mechanism-check.test.js",
      "last_modified": "2026-06-13T05:17:27.903Z",
      "test_count": 4,
      "bucket": "C",
      "bucket_reason": "imports bypass function from core/meta-state.js at line 7",
      "dangling": false,
      "dangling_patterns": [],
      "gap": false
    },
    {
      "file": "tools/learning-loop-mcp/__tests__/bash-gate-runtime-state-record.test.js",
      "last_modified": "2026-06-12T17:27:29.612Z",
      "test_count": 0,
      "bucket": "A",
      "bucket_reason": "no file I/O; MCP-only logic",
      "dangling": false,
      "dangling_patterns": [],
      "gap": false
    },
    {
      "file": "tools/learning-loop-mcp/__tests__/bridge-2-unit.test.js",
      "last_modified": "2026-06-06T05:05:21.482Z",
      "test_count": 12,
      "bucket": "A",
      "bucket_reason": "no file I/O; MCP-only logic",
      "dangling": false,
      "dangling_patterns": [],
      "gap": false
    },
    {
      "file": "tools/learning-loop-mcp/__tests__/budget-option-c-e2e.test.js",
      "last_modified": "2026-06-06T05:05:21.482Z",
      "test_count": 7,
      "bucket": "C",
      "bucket_reason": "imports bypass function from core/meta-state.js at line 9",
      "dangling": false,
      "dangling_patterns": [],
      "gap": false
    },
    {
      "file": "tools/learning-loop-mcp/__tests__/build-inverse-indexes.test.js",
      "last_modified": "2026-06-10T10:42:22.642Z",
      "test_count": 4,
      "bucket": "C",
      "bucket_reason": "imports bypass function from core/meta-state.js at line 4",
      "dangling": false,
      "dangling_patterns": [],
      "gap": false
    },
    {
      "file": "tools/learning-loop-mcp/__tests__/check-grounding.test.js",
      "last_modified": "2026-06-07T05:03:31.120Z",
      "test_count": 30,
      "bucket": "A",
      "bucket_reason": "no file I/O; MCP-only logic",
      "dangling": false,
      "dangling_patterns": [],
      "gap": false
    },
    {
      "file": "tools/learning-loop-mcp/__tests__/cold-session-churn-regression.test.js",
      "last_modified": "2026-06-10T06:43:35.441Z",
      "test_count": 2,
      "bucket": "C",
      "bucket_reason": "imports bypass function from core/meta-state.js at line 16",
      "dangling": false,
      "dangling_patterns": [],
      "gap": false
    },
    {
      "file": "tools/learning-loop-mcp/__tests__/cold-session-discoverability.test.cjs",
      "last_modified": "2026-06-13T05:40:04.334Z",
      "test_count": 8,
      "bucket": "C",
      "bucket_reason": "imports bypass function from core/meta-state.js at line 358",
      "dangling": false,
      "dangling_patterns": [],
      "gap": false
    },
    {
      "file": "tools/learning-loop-mcp/__tests__/cold-session-freshness.test.js",
      "last_modified": "2026-06-10T06:52:15.359Z",
      "test_count": 1,
      "bucket": "A",
      "bucket_reason": "no file I/O; MCP-only logic",
      "dangling": false,
      "dangling_patterns": [],
      "gap": false
    },
    {
      "file": "tools/learning-loop-mcp/__tests__/cold-tier-regression.test.js",
      "last_modified": "2026-06-11T17:51:43.988Z",
      "test_count": 1,
      "bucket": "C",
      "bucket_reason": "imports bypass function from core/meta-state.js at line 3",
      "dangling": false,
      "dangling_patterns": [],
      "gap": false
    },
    {
      "file": "tools/learning-loop-mcp/__tests__/cross-surface.test.js",
      "last_modified": "2026-06-06T05:05:21.482Z",
      "test_count": 0,
      "bucket": "A",
      "bucket_reason": "no file I/O; MCP-only logic",
      "dangling": false,
      "dangling_patterns": [],
      "gap": false
    },
    {
      "file": "tools/learning-loop-mcp/__tests__/derive-status.test.js",
      "last_modified": "2026-06-09T13:27:25.787Z",
      "test_count": 25,
      "bucket": "A",
      "bucket_reason": "no file I/O; MCP-only logic",
      "dangling": false,
      "dangling_patterns": [],
      "gap": false
    },
    {
      "file": "tools/learning-loop-mcp/__tests__/fix-loop-design-refs.test.js",
      "last_modified": "2026-06-11T17:50:05.541Z",
      "test_count": 3,
      "bucket": "C",
      "bucket_reason": "imports bypass function from core/meta-state.js at line 1",
      "dangling": false,
      "dangling_patterns": [],
      "gap": false
    },
    {
      "file": "tools/learning-loop-mcp/__tests__/frontmatter-splitter.test.js",
      "last_modified": "2026-06-06T05:05:21.482Z",
      "test_count": 6,
      "bucket": "A",
      "bucket_reason": "no file I/O; MCP-only logic",
      "dangling": false,
      "dangling_patterns": [],
      "gap": false
    },
    {
      "file": "tools/learning-loop-mcp/__tests__/g8-subcommand-class-entry.test.js",
      "last_modified": "2026-06-13T05:17:54.301Z",
      "test_count": 1,
      "bucket": "A",
      "bucket_reason": "no file I/O; MCP-only logic",
      "dangling": false,
      "dangling_patterns": [],
      "gap": false
    },
    {
      "file": "tools/learning-loop-mcp/__tests__/gate-logic-budget.test.js",
      "last_modified": "2026-06-06T05:05:21.482Z",
      "test_count": 0,
      "bucket": "A",
      "bucket_reason": "no file I/O; MCP-only logic",